{
  "$schema": "./parity-ledger.schema.json",
  "version": 1,
  "source": {
    "repository": "https://github.com/Donchitos/Claude-Code-Game-Studios",
    "commit": "984023ddac0d5e27624f2baacde6105e45de375f",
    "license": "MIT",
    "attribution": "Donchitos and Claude Code Game Studios contributors",
    "verified_date": "2026-07-30"
  },
  "expected": {
    "skill": 73,
    "role": 49,
    "hook-behavior": 12,
    "rule": 11,
    "template": 40,
    "native-skill": 12,
    "total-core-skills": 85
  },
  "actual": {
    "skill": 73,
    "role": 49,
    "rule": 11,
    "template": 40,
    "hook-behavior": 12,
    "native-skill": 12,
    "total-core-skills": 85
  },
  "entries": [
    {
      "kind": "hook-behavior",
      "id": "detect-gaps",
      "source_path": ".claude/hooks/detect-gaps.sh",
      "source_commit": "984023ddac0d5e27624f2baacde6105e45de375f",
      "source_blob": "2a2c96da8c9cb2d9081a1a94a518e6ad94a6ba5e",
      "destination": "plugins/ai-game-studio-automation/hooks/hooks.json",
      "codex_mappings": [
        "SessionStart:orientation-and-gap-detection"
      ],
      "status": "replaced",
      "tests": [
        "parity-count",
        "hook-event-fixtures",
        "windows-posix-command-paths"
      ]
    },
    {
      "kind": "hook-behavior",
      "id": "log-agent",
      "source_path": ".claude/hooks/log-agent.sh",
      "source_commit": "984023ddac0d5e27624f2baacde6105e45de375f",
      "source_blob": "e39a5e7294be60e4d7588b235dc5c90c965148b0",
      "destination": "plugins/ai-game-studio-automation/hooks/hooks.json",
      "codex_mappings": [
        "SubagentStart:bounded-audit-log"
      ],
      "status": "replaced",
      "tests": [
        "parity-count",
        "hook-event-fixtures",
        "windows-posix-command-paths"
      ]
    },
    {
      "kind": "hook-behavior",
      "id": "log-agent-stop",
      "source_path": ".claude/hooks/log-agent-stop.sh",
      "source_commit": "984023ddac0d5e27624f2baacde6105e45de375f",
      "source_blob": "afbd28196d79f2355f1be7179476d2a6cd38600b",
      "destination": "plugins/ai-game-studio-automation/hooks/hooks.json",
      "codex_mappings": [
        "SubagentStop:bounded-audit-log"
      ],
      "status": "replaced",
      "tests": [
        "parity-count",
        "hook-event-fixtures",
        "windows-posix-command-paths"
      ]
    },
    {
      "kind": "hook-behavior",
      "id": "notify",
      "source_path": ".claude/hooks/notify.sh",
      "source_commit": "984023ddac0d5e27624f2baacde6105e45de375f",
      "source_blob": "661b0bd618885debd653240fac60e80d97e3d34f",
      "destination": "plugins/ai-game-studio-automation/hooks/hooks.json",
      "codex_mappings": [
        "Stop:best-effort-notification",
        "SessionEnd:best-effort-notification"
      ],
      "status": "replaced",
      "tests": [
        "parity-count",
        "hook-event-fixtures",
        "windows-posix-command-paths"
      ]
    },
    {
      "kind": "hook-behavior",
      "id": "post-compact",
      "source_path": ".claude/hooks/post-compact.sh",
      "source_commit": "984023ddac0d5e27624f2baacde6105e45de375f",
      "source_blob": "92d57fa90da9f24403c6f8e34fad01b224a9cb8c",
      "destination": "plugins/ai-game-studio-automation/hooks/hooks.json",
      "codex_mappings": [
        "PostCompact:state-restoration"
      ],
      "status": "replaced",
      "tests": [
        "parity-count",
        "hook-event-fixtures",
        "windows-posix-command-paths"
      ]
    },
    {
      "kind": "hook-behavior",
      "id": "pre-compact",
      "source_path": ".claude/hooks/pre-compact.sh",
      "source_commit": "984023ddac0d5e27624f2baacde6105e45de375f",
      "source_blob": "4d4842f5f1b9409033556451632476a11e89958e",
      "destination": "plugins/ai-game-studio-automation/hooks/hooks.json",
      "codex_mappings": [
        "PreCompact:state-preservation"
      ],
      "status": "replaced",
      "tests": [
        "parity-count",
        "hook-event-fixtures",
        "windows-posix-command-paths"
      ]
    },
    {
      "kind": "hook-behavior",
      "id": "session-start",
      "source_path": ".claude/hooks/session-start.sh",
      "source_commit": "984023ddac0d5e27624f2baacde6105e45de375f",
      "source_blob": "05687d19723fb02e9ebc04974a516a67689aeec2",
      "destination": "plugins/ai-game-studio-automation/hooks/hooks.json",
      "codex_mappings": [
        "SessionStart:orientation-and-gap-detection"
      ],
      "status": "replaced",
      "tests": [
        "parity-count",
        "hook-event-fixtures",
        "windows-posix-command-paths"
      ]
    },
    {
      "kind": "hook-behavior",
      "id": "session-stop",
      "source_path": ".claude/hooks/session-stop.sh",
      "source_commit": "984023ddac0d5e27624f2baacde6105e45de375f",
      "source_blob": "2b78ac2505ed20242c5ce799ef8df75b5e7db944",
      "destination": "plugins/ai-game-studio-automation/hooks/hooks.json",
      "codex_mappings": [
        "Stop:session-summary",
        "SessionEnd:session-archive"
      ],
      "status": "replaced",
      "tests": [
        "parity-count",
        "hook-event-fixtures",
        "windows-posix-command-paths"
      ]
    },
    {
      "kind": "hook-behavior",
      "id": "validate-assets",
      "source_path": ".claude/hooks/validate-assets.sh",
      "source_commit": "984023ddac0d5e27624f2baacde6105e45de375f",
      "source_blob": "4468524158ee0344731dcd480facf257cdbadd8a",
      "destination": "plugins/ai-game-studio-automation/hooks/hooks.json",
      "codex_mappings": [
        "PostToolUse:asset-validation"
      ],
      "status": "replaced",
      "tests": [
        "parity-count",
        "hook-event-fixtures",
        "windows-posix-command-paths"
      ]
    },
    {
      "kind": "hook-behavior",
      "id": "validate-commit",
      "source_path": ".claude/hooks/validate-commit.sh",
      "source_commit": "984023ddac0d5e27624f2baacde6105e45de375f",
      "source_blob": "530b433721b970d9aef0c13398e8595ad81365ea",
      "destination": "plugins/ai-game-studio-automation/hooks/hooks.json",
      "codex_mappings": [
        "PreToolUse:commit-safeguard"
      ],
      "status": "replaced",
      "tests": [
        "parity-count",
        "hook-event-fixtures",
        "windows-posix-command-paths"
      ]
    },
    {
      "kind": "hook-behavior",
      "id": "validate-push",
      "source_path": ".claude/hooks/validate-push.sh",
      "source_commit": "984023ddac0d5e27624f2baacde6105e45de375f",
      "source_blob": "e9aff2eb0b3d85d6d5aa4923dc73ff7e89639e51",
      "destination": "plugins/ai-game-studio-automation/hooks/hooks.json",
      "codex_mappings": [
        "PreToolUse:push-safeguard"
      ],
      "status": "replaced",
      "tests": [
        "parity-count",
        "hook-event-fixtures",
        "windows-posix-command-paths"
      ]
    },
    {
      "kind": "hook-behavior",
      "id": "validate-skill-change",
      "source_path": ".claude/hooks/validate-skill-change.sh",
      "source_commit": "984023ddac0d5e27624f2baacde6105e45de375f",
      "source_blob": "23d657db0849540dc13920d869cc120869890bc2",
      "destination": "plugins/ai-game-studio-automation/hooks/hooks.json",
      "codex_mappings": [
        "PostToolUse:skill-validation"
      ],
      "status": "replaced",
      "tests": [
        "parity-count",
        "hook-event-fixtures",
        "windows-posix-command-paths"
      ]
    },
    {
      "kind": "role",
      "id": "accessibility-specialist",
      "source_path": ".claude/agents/accessibility-specialist.md",
      "source_commit": "984023ddac0d5e27624f2baacde6105e45de375f",
      "source_blob": "069165d94c57e7c9d2194e1b21ab31a7d2ee99f7",
      "destination": "plugins/ai-game-studio-automation/templates/agents/accessibility-specialist.toml",
      "status": "ported",
      "tests": [
        "parity-count",
        "toml-parse",
        "inheritance-policy",
        "codex-runtime-scan"
      ]
    },
    {
      "kind": "role",
      "id": "ai-programmer",
      "source_path": ".claude/agents/ai-programmer.md",
      "source_commit": "984023ddac0d5e27624f2baacde6105e45de375f",
      "source_blob": "e7e49e06046696f41bd9da25eab88260959e2423",
      "destination": "plugins/ai-game-studio-automation/templates/agents/ai-programmer.toml",
      "status": "ported",
      "tests": [
        "parity-count",
        "toml-parse",
        "inheritance-policy",
        "codex-runtime-scan"
      ]
    },
    {
      "kind": "role",
      "id": "analytics-engineer",
      "source_path": ".claude/agents/analytics-engineer.md",
      "source_commit": "984023ddac0d5e27624f2baacde6105e45de375f",
      "source_blob": "0a27c4d061b6673df1231725065e470391e05c36",
      "destination": "plugins/ai-game-studio-automation/templates/agents/analytics-engineer.toml",
      "status": "ported",
      "tests": [
        "parity-count",
        "toml-parse",
        "inheritance-policy",
        "codex-runtime-scan"
      ]
    },
    {
      "kind": "role",
      "id": "art-director",
      "source_path": ".claude/agents/art-director.md",
      "source_commit": "984023ddac0d5e27624f2baacde6105e45de375f",
      "source_blob": "430115b327644004a767590b16f7dc9029a1055b",
      "destination": "plugins/ai-game-studio-automation/templates/agents/art-director.toml",
      "status": "ported",
      "tests": [
        "parity-count",
        "toml-parse",
        "inheritance-policy",
        "codex-runtime-scan"
      ]
    },
    {
      "kind": "role",
      "id": "audio-director",
      "source_path": ".claude/agents/audio-director.md",
      "source_commit": "984023ddac0d5e27624f2baacde6105e45de375f",
      "source_blob": "bdc38d7b50c664fd7cf55424dd43ec34438d189b",
      "destination": "plugins/ai-game-studio-automation/templates/agents/audio-director.toml",
      "status": "ported",
      "tests": [
        "parity-count",
        "toml-parse",
        "inheritance-policy",
        "codex-runtime-scan"